{
  "manifest_version": 2,
  "bundle": {
    "platform": "windows",
    "arch": "x64",
    "vs_ref": "R81",
    "python_version": "3.13.17",
    "ffmpeg_policy": "lgpl-only",
    "plugin_layout": "R74+ site-packages/vapoursynth/plugins only",
    "notes": "Deterministic Windows media runtime contract. VapourSynth plugins are installed only in the canonical site-packages/vapoursynth/plugins directory; native media components are not present in code-only update ZIPs, so installations crossing this runtime fingerprint require a complete portable bundle refresh. BtbN FFmpeg remains an immutable retained end-of-month LGPL-only release-branch artifact.",
    "runtime_fingerprints": {
      "analysis": "3155ae5b289b291dd4455618b90933bcd883548129686c33d036d9d7f71e36e3",
      "probe": "da4ce68ddc665bbbb5b3afcbfcd07891b06139ab413f421027beb1af609f79fa",
      "alignment": "4bee154435c566f007fa948c609ed6926ea3bdbf6cbe468c3c9b660503c3e858",
      "index": "f125953022b6d62dd6aaf53f4b85bee51d206878100a51cf40c9e9e4afa879b1",
      "full": "3ba680493a218e486baabbff812ad5047c50b471be742d420e721579fc8eaad0"
    }
  },
  "artifacts": [
    {
      "id": "ffmpeg-btbn-win64-lgpl-8.1-2026-09-30",
      "name": "FFmpeg (BtbN build, win64, LGPL-only)",
      "version": "n8.1.3-9-g29e619e767 (autobuild-2026-09-30-13-08)",
      "url": "https://github.com/BtbN/FFmpeg-Builds/releases/download/autobuild-2026-09-30-13-08/ffmpeg-n8.1.3-9-g29e619e767-win64-lgpl-8.1.zip",
      "source_url": "https://codeload.github.com/FFmpeg/FFmpeg/tar.gz/29e619e767cde9045a75c29bc9a8278ae7b3a98b",
      "build_source_url": "https://codeload.github.com/BtbN/FFmpeg-Builds/tar.gz/6c9aec5fc9a72ec3abedd1fa84db141fa18cf52b",
      "sha256": "4a7642b2264c03e8a0ce8a3825b933ee5580656f45695a086fe7e294045ffc0a",
      "bytes": 170611883,
      "license": {
        "spdx": "LGPL-2.1-or-later",
        "url": "https://ffmpeg.org/legal.html",
        "notes": "The archive includes a LICENSE.txt file; distribute it with the bundle."
      },
      "install": {
        "type": "extract",
        "destination": "ffmpeg",
        "strip_prefix": "ffmpeg-n8.1.3-9-g29e619e767-win64-lgpl-8.1/"
      },
      "release_date": "2026-09-30",
      "source_kind": "release",
      "source_ref": "autobuild-2026-09-30-13-08",
      "source_sha256": "8e4699bcb6a311772e8f513cc72ce27328891b82a598b82e7cff3dfe580875a0",
      "source_bytes": 16922506,
      "build_source_commit": "6c9aec5fc9a72ec3abedd1fa84db141fa18cf52b",
      "build_source_sha256": "81da4f7c878dc0f60e6b8d0049a112e32178e20f025d468fe4e99e77b2dfe0ec",
      "build_source_bytes": 107893,
      "notes": "Retained end-of-month BtbN Windows x64 LGPL-only artifact from FFmpeg's stable 8.1 release branch; no GPL or nonfree profile is permitted.",
      "source_commit": "29e619e767cde9045a75c29bc9a8278ae7b3a98b"
    },
    {
      "id": "python-embed-amd64",
      "name": "Python embeddable package (amd64)",
      "version": "3.13.17",
      "url": "https://www.python.org/ftp/python/3.13.17/python-3.13.17-embed-amd64.zip",
      "source_url": "https://www.python.org/ftp/python/3.13.17/Python-3.13.17.tgz",
      "sha256": "9e35319bffedab8b36ad44d8f377cb4f1733bcec257a0b6d04d94f01486ddb38",
      "bytes": 11441267,
      "license": {
        "spdx": "Python-2.0",
        "url": "https://docs.python.org/3/license.html"
      },
      "install": {
        "type": "extract",
        "destination": "python"
      },
      "release_date": "2026-10-21",
      "source_kind": "release",
      "source_ref": "3.13.17",
      "source_sha256": "9cb057caa588f122577a5054a22531cd9c23ab6706f1a19bc95a55380a895177",
      "source_bytes": 30201125
    },
    {
      "id": "vapoursynth-portable-r81",
      "name": "VapourSynth 64-bit portable",
      "version": "R81",
      "url": "https://github.com/vapoursynth/vapoursynth/releases/download/R81/VapourSynth64-Portable-R81.zip",
      "source_url": "https://codeload.github.com/vapoursynth/vapoursynth/tar.gz/dd11a9da6f8e2bb24ab4bb084d44bf01fb93612a",
      "sha256": "6d625bd3b4d68697a7664a886f3a5e2f1df1a4744b4811bf77bd944baed63436",
      "bytes": 31797504,
      "license": {
        "spdx": "LGPL-2.1-or-later",
        "url": "https://raw.githubusercontent.com/vapoursynth/vapoursynth/dd11a9da6f8e2bb24ab4bb084d44bf01fb93612a/COPYING.LESSER",
        "files": [
          {
            "path": "licenses/common/LGPL-2.1.txt",
            "sha256": "b634ab5640e258563c536e658cad87080553df6f34f62269a21d554844e58bfe",
            "source_url": "https://raw.githubusercontent.com/vapoursynth/vapoursynth/dd11a9da6f8e2bb24ab4bb084d44bf01fb93612a/COPYING.LESSER"
          }
        ]
      },
      "install": {
        "type": "extract",
        "destination": "vs/core"
      },
      "notes": "R81 stable portable runtime with core API R4.3, GPU transfer and memory-model fixes, Matroska muxer and logging fixes. Frame Compare keeps its CPU-frame path. The selected CPython 3.12 ABI3 wheel supports CPython 3.13; native builds require a C++20 compiler.",
      "release_date": "2026-10-04",
      "source_kind": "release",
      "source_ref": "R81",
      "source_sha256": "8b539506bba0fce6794d905da771a1b88a5cf2288a99ae0d32b8acd675240391",
      "source_bytes": 1134224,
      "source_commit": "dd11a9da6f8e2bb24ab4bb084d44bf01fb93612a"
    },
    {
      "id": "vs-plugin-lsmas-1310.0.0.0-win-amd64-wheel",
      "name": "L-SMASH-Works (official VapourSynth plugin wheel)",
      "version": "1310.0.0.0",
      "url": "https://files.pythonhosted.org/packages/a2/4f/f5804dbeb6563486e1d72ce3e72cb9ae2c7201c6660112447f2e1c6f85ec/vapoursynth_lsmas-1310.0.0.0-py3-none-win_amd64.whl",
      "source_url": "https://files.pythonhosted.org/packages/bd/cb/780219eb9597b3d063a862bc004ba4b324d060076210605bc8c50859cbc2/vapoursynth_lsmas-1310.0.0.0.tar.gz",
      "sha256": "8197e2c901ff7b9ac651a66819986bfd993767a0b656a8d11c8f5b53829d2f6b",
      "bytes": 11530241,
      "license": {
        "spdx": "ISC AND LGPL-2.1-or-later AND Zlib AND BSD-2-Clause AND MIT AND BSD-3-Clause",
        "url": "https://raw.githubusercontent.com/HomeOfAviSynthPlusEvolution/L-SMASH-Works/7e65185d3f08ba4ad191e9a5cbba3e2c6fd3bb67/VapourSynth/LICENSE",
        "files": [
          {
            "path": "licenses/lsmash-works/VapourSynth-LICENSE.txt",
            "sha256": "2e1252454a8fcc24144ce94173d6cf90cc7a10954007efd4a2a0f58eec4c73cb",
            "source_url": "https://raw.githubusercontent.com/HomeOfAviSynthPlusEvolution/L-SMASH-Works/7e65185d3f08ba4ad191e9a5cbba3e2c6fd3bb67/VapourSynth/LICENSE"
          },
          {
            "path": "licenses/common/LGPL-2.1.txt",
            "sha256": "b634ab5640e258563c536e658cad87080553df6f34f62269a21d554844e58bfe",
            "source_url": "https://raw.githubusercontent.com/vapoursynth/vapoursynth/732845793a1caf5838d4f7b94f6ce668a19c908e/COPYING.LESSER"
          },
          {
            "path": "licenses/lsmash-works/dependencies/FFmpeg-COPYING.LGPLv2.1.txt",
            "sha256": "246041b6ecf9bc32d718a62c57877c78b5eb397b6467e74ed7ae2626ab189c30",
            "source_url": "https://raw.githubusercontent.com/HomeOfAviSynthPlusEvolution/FFmpeg/39c24f36247f370864ce86ebdf2aa936151f4bfc/COPYING.LGPLv2.1"
          },
          {
            "path": "licenses/lsmash-works/dependencies/L-SMASH-LICENSE.txt",
            "sha256": "f778761540555e63528418e75784c0ed7bf2b89ab11f5ddbfd4bec7aa540e79d",
            "source_url": "https://raw.githubusercontent.com/HomeOfAviSynthPlusEvolution/l-smash/d186eb95388710a7a91f6fd353169b457ebbb9db/LICENSE"
          },
          {
            "path": "licenses/lsmash-works/dependencies/obuparse-LICENSE.txt",
            "sha256": "c2a92a24f409940e3d510ba5e8c520141dc103748d7d0d23798364cc160bd074",
            "source_url": "https://raw.githubusercontent.com/HomeOfAviSynthPlusEvolution/obuparse/a67fcab9cd9d56c866a7a860f8c4aeb91b8817e8/LICENSE"
          },
          {
            "path": "licenses/lsmash-works/dependencies/zlib-LICENSE.txt",
            "sha256": "e32ff4e00d9d94930537635291da39e7e612703334bf6fde8c7f1686fe8a45a2",
            "source_url": "https://raw.githubusercontent.com/madler/zlib/v1.3.2/LICENSE"
          },
          {
            "path": "licenses/lsmash-works/dependencies/dav1d-COPYING.txt",
            "sha256": "dd92c3c2247c5651606fc23a5e2d6a1ebc5ace9a3e49cbde0e12f05ad1cb1ee5",
            "source_url": "https://code.videolan.org/videolan/dav1d/-/raw/1.5.3/COPYING"
          },
          {
            "path": "licenses/lsmash-works/dependencies/libxml2-Copyright.txt",
            "sha256": "5d4873884a890122a4b9b20ad56ac6f7da1d796a5bfcf04a427970ac96217626",
            "source_url": "https://gitlab.gnome.org/GNOME/libxml2/-/raw/v2.15.3/Copyright"
          },
          {
            "path": "licenses/lsmash-works/dependencies/nv-codec-headers-MIT-notice.txt",
            "sha256": "72b60be67644d841bfd54a042875b5846294d357040dd7ac8e38bde20d9e8f97",
            "source_url": "https://raw.githubusercontent.com/FFmpeg/nv-codec-headers/n13.0.19.0/include/ffnvcodec/nvEncodeAPI.h"
          },
          {
            "path": "licenses/lsmash-works/dependencies/xxHash-LICENSE.txt",
            "sha256": "6ffedbc0f7878612d2b23589f1ff2ab15633e1df7963a5d9fc750ec5500c7e7a",
            "source_url": "https://raw.githubusercontent.com/Cyan4973/xxHash/v0.8.3/LICENSE"
          },
          {
            "path": "licenses/lsmash-works/dependencies/mfx-dispatch-LICENSE.txt",
            "sha256": "f03bff2bd2f916104d12d50caeaab41875086943ea8b88983eafa5d84890593c",
            "source_url": "https://raw.githubusercontent.com/lu-zero/mfx_dispatch/f6aac4576826ed821c81231fdfb0d24047158e7d/LICENSE"
          },
          {
            "path": "licenses/lsmash-works/dependencies/libvpx-LICENSE.txt",
            "sha256": "8267348d5af1262c11d1a08de2f5afc77457755f1ac658627dd9acf71011d615",